{
  "contract_version": "1.0",
  "universe_id": "alphaforge_us_equity_30_v1.0",
  "universe_version": "whitelist_v1.0",
  "symbols": ["MSFT", "AAPL", "NVDA", "GOOGL", "AMZN"],
  "start_date": "2016-01-04",
  "end_date": "2026-06-30",
  "initial_cash": 100000,
  "resolution": "Daily",
  "rebalance_frequency": "Monthly",
  "top_k": 3,
  "target_gross": 0.95,
  "max_position_weight": 0.35,
  "max_drawdown": 0.25,
  "transaction_cost_bps": 10,
  "slippage_bps": 5,
  "long_only": true,
  "max_leverage": 1.0,
  "cash_allowed": true,
  "benchmark": "SPY",
  "risk_filter_symbol": "QQQ",
  "risk_sma_period": 200,
  "data_version": "tiingo-eod-v1",
  "random_seed": 42
}
